{
  "schema_version": "1.0.6",
  "advisor_id": "deng-suixin",
  "review_status": "unresolved",
  "reviewed_at": null,
  "reviewer_role": "codex_mechanical_migration",
  "advisor_identity": {
    "name_match_status": "verified",
    "institution_match_status": "verified",
    "school_or_department_match_status": "verified",
    "official_profile_match_status": "verified",
    "orcid_status": "verified",
    "candidate_orcid": "0000-0003-4795-2570",
    "official_profile_url": "https://life.csu.edu.cn/info/1042/2547.htm",
    "human_review_status": "pending",
    "notes": "Publication identity was checked per paper; human review remains pending. ORCID state follows the recorded chain and is not a release approval.",
    "official_profile_email": "sxdeng@csu.edu.cn",
    "official_profile_email_source_url": "https://life.csu.edu.cn/info/1042/2547.htm",
    "orcid_verification_evidence_ids": [
      "E3",
      "E4",
      "E5",
      "E7"
    ],
    "orcid_verification_basis": [
      "Publication records E3, E4, E5, E7 carry the same ORCID 0000-0003-4795-2570 and at least one current-CSU link."
    ]
  },
  "publication_identity": [
    {
      "evidence_id": "E2",
      "identity_status": "verified",
      "verification_basis": [
        "Official representative list plus official email and current affiliation.",
        "The official CSU profile explicitly lists this publication."
      ],
      "matched_author_name": "Suixin Deng",
      "matched_institution": "Central South University",
      "matched_institution_source_url": "https://doi.org/10.1186/s12993-025-00287-w",
      "matched_author_email": "sxdeng@csu.edu.cn",
      "matched_author_email_source_url": "https://doi.org/10.1186/s12993-025-00287-w",
      "matched_orcid": null,
      "orcid_source_url": null,
      "notes": "Official representative list plus official email and current affiliation."
    },
    {
      "evidence_id": "E3",
      "identity_status": "verified",
      "verification_basis": [
        "Official representative list plus exact ORCID, email and current affiliation.",
        "The official CSU profile explicitly lists this publication."
      ],
      "matched_author_name": "Suixin Deng",
      "matched_institution": "Central South University",
      "matched_institution_source_url": "https://doi.org/10.1038/s41467-025-59113-6",
      "matched_author_email": "sxdeng@csu.edu.cn",
      "matched_author_email_source_url": "https://doi.org/10.1038/s41467-025-59113-6",
      "matched_orcid": "0000-0003-4795-2570",
      "orcid_source_url": "https://doi.org/10.1038/s41467-025-59113-6",
      "notes": "Official representative list plus exact ORCID, email and current affiliation."
    },
    {
      "evidence_id": "E4",
      "identity_status": "verified",
      "verification_basis": [
        "Official representative list plus exact ORCID and publication-time Fudan affiliation.",
        "The official CSU profile explicitly lists this publication."
      ],
      "matched_author_name": "Suixin Deng",
      "matched_institution": "Fudan University",
      "matched_institution_source_url": "https://doi.org/10.1038/s41467-023-43292-1",
      "matched_author_email": null,
      "matched_author_email_source_url": null,
      "matched_orcid": "0000-0003-4795-2570",
      "orcid_source_url": "https://doi.org/10.1038/s41467-023-43292-1",
      "notes": "Official representative list plus exact ORCID and publication-time Fudan affiliation."
    },
    {
      "evidence_id": "E5",
      "identity_status": "verified",
      "verification_basis": [
        "Official representative list plus exact ORCID and publication-time Fudan affiliation.",
        "The official CSU profile explicitly lists this publication."
      ],
      "matched_author_name": "Suixin Deng",
      "matched_institution": "Fudan University",
      "matched_institution_source_url": "https://doi.org/10.1038/s41380-022-01790-6",
      "matched_author_email": null,
      "matched_author_email_source_url": null,
      "matched_orcid": "0000-0003-4795-2570",
      "orcid_source_url": "https://doi.org/10.1038/s41380-022-01790-6",
      "notes": "Official representative list plus exact ORCID and publication-time Fudan affiliation."
    },
    {
      "evidence_id": "E6",
      "identity_status": "verified",
      "verification_basis": [
        "Official representative list plus PubMed DOI, first-author position and publication-time BNU affiliation.",
        "The official CSU profile explicitly lists this publication."
      ],
      "matched_author_name": "Suixin Deng",
      "matched_institution": "Beijing Normal University",
      "matched_institution_source_url": "https://doi.org/10.1016/j.neuron.2019.10.038",
      "matched_author_email": null,
      "matched_author_email_source_url": null,
      "matched_orcid": null,
      "orcid_source_url": null,
      "notes": "Official representative list plus PubMed DOI, first-author position and publication-time BNU affiliation."
    },
    {
      "evidence_id": "E7",
      "identity_status": "verified",
      "verification_basis": [
        "Exact ORCID, official email and current affiliation."
      ],
      "matched_author_name": "Suixin Deng",
      "matched_institution": "Central South University",
      "matched_institution_source_url": "https://doi.org/10.1038/s41398-026-04219-8",
      "matched_author_email": "sxdeng@csu.edu.cn",
      "matched_author_email_source_url": "https://doi.org/10.1038/s41398-026-04219-8",
      "matched_orcid": "0000-0003-4795-2570",
      "orcid_source_url": "https://doi.org/10.1038/s41398-026-04219-8",
      "notes": "Exact ORCID, official email and current affiliation."
    },
    {
      "evidence_id": "E8",
      "identity_status": "verified",
      "verification_basis": [
        "Exact current unit and official neurodevelopment direction; retained as candidate."
      ],
      "matched_author_name": "Suixin Deng",
      "matched_institution": "Central South University",
      "matched_institution_source_url": "https://doi.org/10.1038/s41380-026-03681-6",
      "matched_author_email": null,
      "matched_author_email_source_url": null,
      "matched_orcid": null,
      "orcid_source_url": null,
      "notes": "Exact current unit and official neurodevelopment direction; retained as candidate."
    },
    {
      "evidence_id": "E9",
      "identity_status": "verified",
      "verification_basis": [
        "Exact current unit and coherent neuroscience network; retained as candidate."
      ],
      "matched_author_name": "Suixin Deng",
      "matched_institution": "Central South University",
      "matched_institution_source_url": "https://doi.org/10.1038/s41467-026-72935-2",
      "matched_author_email": null,
      "matched_author_email_source_url": null,
      "matched_orcid": null,
      "orcid_source_url": null,
      "notes": "Exact current unit and coherent neuroscience network; retained as candidate."
    }
  ],
  "official_source_identity": [
    {
      "evidence_id": "E1",
      "identity_status": "verified",
      "official_domain_status": "verified",
      "profile_name_match_status": "verified",
      "institution_match_status": "verified",
      "reviewed_at": "2026-09-09",
      "notes": "页面位于中南大学生命科学学院官方域名，标题姓名和机构匹配。"
    }
  ],
  "p0_blockers": [
    {
      "code": "HUMAN_IDENTITY_REVIEW_PENDING",
      "description": "Owner human identity review is pending; machine closure is not approval.",
      "evidence_ids": [
        "E1",
        "E3",
        "E4",
        "E5",
        "E7"
      ]
    }
  ],
  "notes": "Official-list anchors, publication-time affiliations, email/ORCID where available, and explicit same-name counterexamples were kept advisor-local. Owner publication decision 2026-09-10 accepted adopted/featured content only; global identity and release review remain pending."
}
