{
  "schema_version": "1.0.6",
  "advisor_id": "deng-meichun",
  "review_status": "unresolved",
  "reviewed_at": null,
  "reviewer_role": "codex_mechanical_migration",
  "advisor_identity": {
    "name_match_status": "verified",
    "institution_match_status": "verified",
    "school_or_department_match_status": "verified",
    "official_profile_match_status": "verified",
    "orcid_status": "verified",
    "candidate_orcid": "0000-0002-3558-1314",
    "official_profile_url": "https://life.csu.edu.cn/info/1042/2539.htm",
    "human_review_status": "pending",
    "notes": "Publication identity was checked per paper; human review remains pending. ORCID state follows the recorded chain and is not a release approval.",
    "official_profile_email": "dengmch@csu.edu.cn",
    "official_profile_email_source_url": "https://life.csu.edu.cn/info/1042/2539.htm",
    "orcid_verification_evidence_ids": [
      "E8",
      "E11"
    ],
    "orcid_verification_basis": [
      "Publication records E8, E11 carry the same ORCID 0000-0002-3558-1314 and at least one current-CSU link."
    ]
  },
  "publication_identity": [
    {
      "evidence_id": "E2",
      "identity_status": "verified",
      "verification_basis": [
        "Official representative list plus PubMed DOI, author and current affiliation.",
        "The official CSU profile explicitly lists this publication."
      ],
      "matched_author_name": "Meichun Deng",
      "matched_institution": "Central South University",
      "matched_institution_source_url": "https://doi.org/10.1016/j.ijbiomac.2024.136767",
      "matched_author_email": "dengmch@csu.edu.cn",
      "matched_author_email_source_url": "https://doi.org/10.1016/j.ijbiomac.2024.136767",
      "matched_orcid": null,
      "orcid_source_url": null,
      "notes": "Official representative list plus PubMed DOI, author and current affiliation."
    },
    {
      "evidence_id": "E3",
      "identity_status": "verified",
      "verification_basis": [
        "Official representative list plus PubMed DOI, author and current affiliation.",
        "The official CSU profile explicitly lists this publication."
      ],
      "matched_author_name": "Meichun Deng",
      "matched_institution": "Central South University",
      "matched_institution_source_url": "https://doi.org/10.1016/j.isci.2024.111110",
      "matched_author_email": null,
      "matched_author_email_source_url": null,
      "matched_orcid": null,
      "orcid_source_url": null,
      "notes": "Official representative list plus PubMed DOI, author and current affiliation."
    },
    {
      "evidence_id": "E4",
      "identity_status": "verified",
      "verification_basis": [
        "Official representative list plus PubMed DOI, author and current affiliation.",
        "The official CSU profile explicitly lists this publication."
      ],
      "matched_author_name": "Meichun Deng",
      "matched_institution": "Central South University",
      "matched_institution_source_url": "https://doi.org/10.3389/fphar.2023.1067665",
      "matched_author_email": null,
      "matched_author_email_source_url": null,
      "matched_orcid": null,
      "orcid_source_url": null,
      "notes": "Official representative list plus PubMed DOI, author and current affiliation."
    },
    {
      "evidence_id": "E5",
      "identity_status": "verified",
      "verification_basis": [
        "Official representative list plus PubMed DOI, author and current affiliation.",
        "The official CSU profile explicitly lists this publication."
      ],
      "matched_author_name": "Meichun Deng",
      "matched_institution": "Central South University",
      "matched_institution_source_url": "https://doi.org/10.1093/eurjpc/zwab099",
      "matched_author_email": null,
      "matched_author_email_source_url": null,
      "matched_orcid": null,
      "orcid_source_url": null,
      "notes": "Official representative list plus PubMed DOI, author and current affiliation."
    },
    {
      "evidence_id": "E6",
      "identity_status": "verified",
      "verification_basis": [
        "Official representative list plus PubMed DOI and publication-time MD Anderson/CSU career affiliation.",
        "The official CSU profile explicitly lists this publication."
      ],
      "matched_author_name": "Meichun Deng",
      "matched_institution": "University of Texas MD Anderson Cancer Center",
      "matched_institution_source_url": "https://doi.org/10.1097/aln.0000000000002648",
      "matched_author_email": null,
      "matched_author_email_source_url": null,
      "matched_orcid": null,
      "orcid_source_url": null,
      "notes": "Official representative list plus PubMed DOI and publication-time MD Anderson/CSU career affiliation."
    },
    {
      "evidence_id": "E7",
      "identity_status": "verified",
      "verification_basis": [
        "Exact current department and established peptide/channel network; retained for Owner selection."
      ],
      "matched_author_name": "Meichun Deng",
      "matched_institution": "Central South University",
      "matched_institution_source_url": "https://doi.org/10.3390/toxins18030124",
      "matched_author_email": null,
      "matched_author_email_source_url": null,
      "matched_orcid": null,
      "orcid_source_url": null,
      "notes": "Exact current department and established peptide/channel network; retained for Owner selection."
    },
    {
      "evidence_id": "E8",
      "identity_status": "verified",
      "verification_basis": [
        "Exact ORCID, official email and current department."
      ],
      "matched_author_name": "Meichun Deng",
      "matched_institution": "Central South University",
      "matched_institution_source_url": "https://doi.org/10.1186/s12951-026-04186-8",
      "matched_author_email": "dengmch@csu.edu.cn",
      "matched_author_email_source_url": "https://doi.org/10.1186/s12951-026-04186-8",
      "matched_orcid": "0000-0002-3558-1314",
      "orcid_source_url": "https://doi.org/10.1186/s12951-026-04186-8",
      "notes": "Exact ORCID, official email and current department."
    },
    {
      "evidence_id": "E9",
      "identity_status": "verified",
      "verification_basis": [
        "Exact current department and established peptide/channel coauthor network."
      ],
      "matched_author_name": "Meichun Deng",
      "matched_institution": "Central South University",
      "matched_institution_source_url": "https://doi.org/10.1016/j.jbc.2025.108286",
      "matched_author_email": null,
      "matched_author_email_source_url": null,
      "matched_orcid": null,
      "orcid_source_url": null,
      "notes": "Exact current department and established peptide/channel coauthor network."
    },
    {
      "evidence_id": "E10",
      "identity_status": "verified",
      "verification_basis": [
        "Official email, current department and pain topic agree."
      ],
      "matched_author_name": "Meichun Deng",
      "matched_institution": "Central South University",
      "matched_institution_source_url": "https://doi.org/10.1016/j.phymed.2022.154598",
      "matched_author_email": "dengmch@csu.edu.cn",
      "matched_author_email_source_url": "https://doi.org/10.1016/j.phymed.2022.154598",
      "matched_orcid": null,
      "orcid_source_url": null,
      "notes": "Official email, current department and pain topic agree."
    },
    {
      "evidence_id": "E11",
      "identity_status": "verified",
      "verification_basis": [
        "Exact ORCID, official email and current department."
      ],
      "matched_author_name": "Meichun Deng",
      "matched_institution": "Central South University",
      "matched_institution_source_url": "https://doi.org/10.1007/s10571-022-01211-w",
      "matched_author_email": "dengmch@csu.edu.cn",
      "matched_author_email_source_url": "https://doi.org/10.1007/s10571-022-01211-w",
      "matched_orcid": "0000-0002-3558-1314",
      "orcid_source_url": "https://doi.org/10.1007/s10571-022-01211-w",
      "notes": "Exact ORCID, official email and current department."
    }
  ],
  "official_source_identity": [
    {
      "evidence_id": "E1",
      "identity_status": "verified",
      "official_domain_status": "verified",
      "profile_name_match_status": "verified",
      "institution_match_status": "verified",
      "reviewed_at": "2026-09-09",
      "notes": "页面位于中南大学生命科学学院官方域名，标题姓名和机构匹配。"
    }
  ],
  "p0_blockers": [
    {
      "code": "HUMAN_IDENTITY_REVIEW_PENDING",
      "description": "Owner human identity review is pending; machine closure is not approval.",
      "evidence_ids": [
        "E1",
        "E8",
        "E11"
      ]
    }
  ],
  "notes": "Official-list anchors, publication-time affiliations, email/ORCID where available, and explicit same-name counterexamples were kept advisor-local. Owner publication decision 2026-09-10 accepted adopted/featured content only; global identity and release review remain pending."
}
